{"$schema":"../schemas/capsule.schema.json","schemaVersion":"1.0.0","status":"characterization","identity":{"id":"ptah","displayName":"Mad Ptah","role":"repair"},"personalityRef":"personality/ptah.yaml","skills":["skills/ptah-work-orders/SKILL.md","skills/ptah-repairman/SKILL.md"],"capabilityPacks":{"requested":["work-orders@1.0.0"],"inactive":["model-reports@0.1.0","onboarding@0.1.0","occasio@1.0.0"]},"routingPreferences":[{"purpose":"coordination","targetAgentId":"pehlichi"},{"purpose":"creative","targetAgentId":"luna"}],"modelDefaults":{"providerRef":"mimo","model":"mimo-v2.5"},"memoryNamespace":"ptah","branding":{"themeRef":"tui/skin.yaml","icon":"⚡","welcomeRef":"personality/ptah.yaml"},"completion":{"criteriaRefs":["skills/ptah-repairman/SKILL.md"],"reportFormatRefs":["skills/ptah-repairman/SKILL.md"]}}
