{"$schema":"../schemas/capsule.schema.json","schemaVersion":"1.0.0","status":"characterization","identity":{"id":"luna","displayName":"Loony Luna","role":"creative"},"personalityRef":"personality/luna.yaml","skills":["skills/creative/SKILL.md"],"capabilityPacks":{"requested":[],"inactive":["work-orders@1.0.0","model-reports@0.1.0","onboarding@0.1.0","occasio@1.0.0"]},"routingPreferences":[{"purpose":"coordination","targetAgentId":"pehlichi"},{"purpose":"repair","targetAgentId":"ptah"}],"modelDefaults":{"providerRef":"mimo","model":"mimo-v2.5"},"memoryNamespace":"luna","branding":{"themeRef":"tui/skin.yaml","icon":"👽","welcomeRef":"personality/luna.yaml"},"completion":{"criteriaRefs":["skills/creative/SKILL.md"],"reportFormatRefs":["skills/creative/SKILL.md"]}}
